{
  "contract_version": "venture-submission/v1",
  "caller": {
    "caller_id": "vorago",
    "auth_subject": "vorago-assessment-service"
  },
  "subject": {
    "submission_id": "sub_night_kitchen_01",
    "founder_ref": "founder_7f3a"
  },
  "idempotency_key": "vorago:sub_night_kitchen_01:v1",
  "evidence_version": "sub_night_kitchen_01:v1",
  "review_trigger": {
    "occurrence_id": "occ_sub_night_kitchen_01",
    "kind": "manual",
    "due_at": "2026-10-21T18:00:00Z"
  },
  "classification": {
    "evidence": [
      "sections.evidence"
    ],
    "context": [
      "sections.context"
    ],
    "policy": [
      "sections.policy"
    ],
    "goal": [
      "sections.goal"
    ],
    "quality": [
      "quality"
    ]
  },
  "sections": {
    "evidence": {
      "title": "Night Kitchen — shared commercial kitchen hours for street-food vendors",
      "problem": "Licensed street-food vendors in mid-size Texas cities need a certified commercial kitchen to prep legally, but commissary kitchens are rented by the month at prices built for restaurants. Vendors working three nights a week pay for hours they never use or prep at home and risk their permit.",
      "solution": "Night Kitchen rents certified commissary kitchens by the hour between 10pm and 6am, when restaurant kitchens sit idle. We handle scheduling, access control and the health-department paper trail; the host restaurant earns rent on dead hours.",
      "market": "There are roughly 1,400 permitted mobile food vendors across Austin, San Antonio and Dallas. Most rent commissary access at 400 to 900 dollars a month. We charge 18 dollars an hour with a 10 hour monthly minimum.",
      "business_model": "Hourly fee split 70/30 with the host kitchen. Vendors prepay a block of hours; hosts are paid out weekly.",
      "traction": "Two host kitchens signed letters of intent in Austin. Twelve vendors on a waitlist from one weekend at a night market. No revenue yet.",
      "competition": "Monthly commissaries, ghost-kitchen operators who want full-time tenants, and informal home prep.",
      "team": "One founder who ran a food truck for four years and holds a current food-manager certification. Looking for a technical co-founder.",
      "risks": "Health-department acceptance of shared overnight use; host kitchens pulling out if cleanup is poor; insurance.",
      "ask": "An honest assessment of whether this is worth building before I quit my day job."
    },
    "context": {
      "stage": "idea",
      "submitted_at": "2026-10-21T17:40:00Z",
      "geography": "Texas, US",
      "sector": "food service"
    },
    "policy": {
      "rubric_version": "venture-rubric/v1",
      "max_feedback_words": 600,
      "token_budget": 120000
    },
    "goal": {
      "decision": "viability_assessment",
      "founder_question": "Is this worth building before I quit my day job?"
    }
  },
  "quality": {
    "total_words": 237,
    "fields_present": 10,
    "fields_total": 10,
    "language": "en",
    "gate": {
      "passed": true,
      "reason": null
    }
  },
  "allowed_recommendations": [
    "viable",
    "not_viable",
    "needs_revision",
    "insufficient_information"
  ],
  "materiality": {
    "always_material": true
  },
  "comparator": {
    "profile": "venture-submission/v1",
    "tolerance": 0.25
  },
  "task_pack_ref": "venture-submission/v1",
  "review_plan_ref": "rp_vorago_venture",
  "review_plan_revision": 3
}
